seating_no,national_no,arabic_name,school_name,moderia_name,branch_desc_new,total_degree,student_case_desc,sex_name
142018,30412180103456,أحمد محمد إبراهيم سعد,ثانوية النيل النموذجية,القاهرة,علمي علوم,392,مستجد,ذكر
142019,30406240178923,محمود السيد عبد الرحمن,ثانوية كفر الدوار,البحيرة,علمي رياضة,367,مستجد,ذكر
142020,30410050189012,عبد الله أحمد ناصر,ثانوية الزقازيق الثانية,الشرقية,علمي علوم,401,باقٍ للإعادة,ذكر
142021,30407300134567,كريم مصطفى عبد المنعم,ثانوية مدينة نصر بنين,القاهرة,علمي علوم,384,مستجد,ذكر
142022,30408190156789,إسلام طارق فتحي حلمي,ثانوية الإسكندرية النموذجية,الإسكندرية,علمي رياضة,358,مستجد,ذكر
